{
  "$schema": "https://open-design.ai/schemas/plugin.v1.json",
  "specVersion": "1.0.0",
  "name": "video-template-frame-takram-organic",
  "title": "Takram Organic Frame",
  "title_i18n": {
    "en": "Takram Organic Frame",
    "zh-CN": "东方柔和有机帧",
    "tr": "Takram Organik Çerçeve"
  },
  "version": "0.1.0",
  "description": "Soft-tech radial node graph as art — frosted rounded card, curved links drawing in, nodes popping outward, gentle float.",
  "description_i18n": {
    "en": "Soft-tech radial node graph as art — frosted rounded card, curved links drawing in, nodes popping outward, gentle float.",
    "zh-CN": "东方柔和有机帧:毛玻璃圆角卡 + 曲线连接描入 + 放射节点弹出 + 柔和漂浮, 米色自然色调",
    "tr": "Sanat eseri gibi yumuşak teknolojili radyal düğüm grafiği - buzlu yuvarlak kart, içeri doğru çekilen kavisli bağlantılar, dışarı doğru fırlayan düğümler, hafifçe süzülme."
  },
  "license": "Apache-2.0",
  "author": {
    "name": "nexu-io",
    "url": "https://github.com/nexu-io",
    "contact": "open-design@nexu.io"
  },
  "homepage": "https://github.com/nexu-io/html-video/tree/main/templates/frame-takram-organic",
  "tags": [
    "video-template",
    "first-party",
    "video",
    "hyperframes",
    "html-video",
    "motion",
    "organic",
    "soft-tech",
    "radial",
    "node-graph",
    "takram",
    "beige",
    "diagram",
    "explainer"
  ],
  "compat": {
    "agentSkills": [
      {
        "path": "./SKILL.md"
      }
    ]
  },
  "od": {
    "kind": "scenario",
    "taskKind": "new-generation",
    "mode": "video",
    "scenario": "video",
    "surface": "hyperframes",
    "engine": "hyperframes",
    "preview": {
      "type": "video",
      "poster": "https://cdn.jsdelivr.net/gh/nexu-io/open-design@main/plugins/_official/video-templates/frame-takram-organic/preview.png",
      "video": "https://cdn.jsdelivr.net/gh/nexu-io/open-design@main/plugins/_official/video-templates/frame-takram-organic/preview.mp4"
    },
    "useCase": {
      "query": {
        "en": "Use the Takram Organic Frame template to turn my concept into a soft-tech radial node graph — a frosted rounded card with curved links drawing in and nodes popping outward around an evolving core. Preserve the template's visual signature, use real content, and avoid lorem ipsum or placeholder images.",
        "zh-CN": "用「东方柔和有机帧」模板把我的概念做成一段柔和科技感放射节点图:毛玻璃圆角卡 + 曲线连接描入 + 节点围绕进化核心放射弹出。保持模板的视觉签名,使用真实内容,避免 lorem ipsum 和占位图片。"
      }
    },
    "inputs": [
      {
        "name": "aspect",
        "label": "Aspect ratio",
        "type": "select",
        "options": [
          "16:9"
        ],
        "default": "16:9"
      },
      {
        "name": "format",
        "label": "Output format",
        "type": "select",
        "options": [
          "mp4",
          "webm"
        ],
        "default": "mp4"
      },
      {
        "name": "durationSec",
        "label": "Duration (seconds)",
        "type": "number",
        "default": 15
      }
    ],
    "context": {
      "skills": [
        {
          "path": "./SKILL.md"
        }
      ],
      "assets": [
        "./template.json",
        "./source"
      ]
    },
    "pipeline": {
      "stages": [
        {
          "id": "compose",
          "atoms": [
            "file-write"
          ]
        },
        {
          "id": "render",
          "atoms": [
            "media-video"
          ]
        }
      ]
    },
    "capabilities": [
      "prompt:inject",
      "fs:write",
      "media:video-generate"
    ],
    "provenance": {
      "origin": {
        "name": "Takram",
        "kind": "design-studio",
        "reference": "Japanese design firm — speculative, organic soft-tech; data-as-art visualisation"
      },
      "via_skill": {
        "name": "huashu-design",
        "author": "alchaincyf (花叔 · 花生)",
        "url": "https://github.com/alchaincyf/huashu-design",
        "license": "MIT",
        "source_file": "assets/showcases/ppt/ppt-takram.html"
      },
      "transformation": "Static PPT showcase → animated hyperframes timeline (frosted rounded card holds the message while curved SVG links draw and radial nodes pop outward around an evolving core, then everything gently floats) built as original CSS/SVG keyframes. Re-coloured palette; original sample data. No upstream source code copied verbatim.\n"
    }
  }
}
