{
  "$schema": "https://open-design.ai/schemas/plugin.v1.json",
  "specVersion": "1.0.0",
  "name": "design-system-source-context-mr4pp7e1",
  "title": "Design System Source Context",
  "version": "0.1.0",
  "description": "This file is generated during setup and should be treated as source evidence for the design-system project. Use it before writing or revising DESIGN.md, previews, tokens, UI kit examples, or assets.",
  "od": {
    "kind": "skill",
    "taskKind": "new-generation",
    "context": {
      "skills": [
        {
          "path": "./SKILL.md"
        }
      ]
    },
    "capabilities": [
      "prompt:inject"
    ]
  }
}
