{
  "$schema": "https://open-design.ai/schemas/plugin.v1.json",
  "specVersion": "1.0.0",
  "name": "data-report-74e73a4541-mqxrp3ow",
  "title": "Data Report 74e73a4541",
  "version": "0.1.0",
  "description": "--- name: data-report zh_name: \"数据可视化报告\" en_name: \"Data Visualization Report\" emoji: \"📊\" description: \"Turns CSV, Excel, or JSON data into a polished visual report page.\" zh_description: \"把 CSV/Excel/JSON 数据转成漂亮的可视化报告页\"",
  "od": {
    "kind": "skill",
    "taskKind": "new-generation",
    "context": {
      "skills": [
        {
          "path": "./SKILL.md"
        }
      ]
    },
    "capabilities": [
      "prompt:inject"
    ]
  }
}
