{
  "$schema": "https://open-design.ai/schemas/plugin.v1.json",
  "specVersion": "1.0.0",
  "name": "platform-a-dashboard-refocus-implementation-plan-mrtbgnt4",
  "title": "Platform A Dashboard Refocus Implementation Plan",
  "version": "0.1.0",
  "description": "> **For agentic workers:** REQUIRED SUB-SKILL: Use superpowers:subagent-driven-development (recommended) or superpowers:executing-plans to implement this plan task-by-task. Steps use checkbox (`- [ ]`) syntax for trackin",
  "od": {
    "kind": "skill",
    "taskKind": "new-generation",
    "context": {
      "skills": [
        {
          "path": "./SKILL.md"
        }
      ]
    },
    "capabilities": [
      "prompt:inject"
    ]
  }
}
