{
  "$schema": "https://open-design.ai/schemas/plugin.v1.json",
  "specVersion": "1.0.0",
  "name": "design-system-spendline-msqb1t49",
  "title": "Design System: Spendline",
  "version": "0.1.0",
  "description": "--- name: Spendline description: A calm, decision-first FinOps workspace that keeps expenditure posture, evidence, and action in one operational system. colors: fog-canvas: \"#f6f7f9\" white-plane: \"#ffffff\" blue-wash: \"#e",
  "od": {
    "kind": "skill",
    "taskKind": "new-generation",
    "context": {
      "skills": [
        {
          "path": "./SKILL.md"
        }
      ]
    },
    "capabilities": [
      "prompt:inject"
    ]
  }
}
